{
  "demo": "Catalyst Analytics R Demo",
  "generated_at": "2026-07-01T00:00:00.000Z",
  "inputs": {
    "scenarioName": "Policy pathway",
    "years": 20,
    "savings": 0.22,
    "emissionsIntensity": 0.07,
    "adaptation": 0.08,
    "restoration": 0.06,
    "humanInvestment": 0.05,
    "initialCapital": 100,
    "initialHuman": 100,
    "initialNatural": 100,
    "emissionsBudget": 120
  },
  "final": {
    "year": 20,
    "produced_capital": 166.4,
    "human_capital": 134.8,
    "natural_capital": 104.5,
    "cumulative_emissions": 99.7,
    "adjusted_savings": 18.3,
    "composite_score": 105.2
  },
  "composite_score": 72.5,
  "budget_ratio": 0.831,
  "interpretation_notes": [
    "Cumulative emissions remain within the selected budget, but review the margin.",
    "Final-period adjusted savings are positive.",
    "Treat this as an exploratory demo, not a forecast or professional analysis."
  ],
  "trajectory": []
}
